[
  {
    "id": "trl.s.guided-fire",
    "name": "Guided Fire",
    "text": "This turn, Gunnbjorn and the warbeasts of his battlegroup have their ranged attack rolls boosted for free while they are inside his CTRL.",
    "cost": 3,
    "rng": "SELF",
    "aoe": "CTRL",
    "dur": "TURN",
    "offensive": false,
    "effect": [
      {
        "code": "guidedFire"
      }
    ],
    "scope": {
      "who": "warbeasts",
      "range": "CTRL"
    },
    "verify": "COST/RNG/AOE/DUR/OFF agree in S1, S2 and S10."
  },
  {
    "id": "trl.s.rock-wall",
    "name": "Rock Wall",
    "text": "Raise a straight stone wall completely inside Gunnbjorn’s CTRL, clear of bases, obstacles and obstructions. It is an obstacle that gives cover; an 80 mm or 120 mm base touching it tears it down.",
    "cost": 2,
    "rng": "CTRL",
    "dur": "UP",
    "offensive": false,
    "effect": [
      {
        "code": "rockWall"
      }
    ],
    "scope": {
      "who": "point"
    },
    "verify": "COST/RNG/DUR agree in S1, S2 and S10 (Up); wall size is the rulebook wall piece, 4 by 3/4 inch."
  },
  {
    "id": "trl.s.sentry",
    "name": "Sentry",
    "text": "A friendly Faction model gains Rapid Fire: it makes one basic ranged attack in your Maintenance Phase.",
    "cost": 2,
    "rng": 6,
    "dur": "UP",
    "offensive": false,
    "effect": [
      {
        "code": "sentry"
      }
    ],
    "scope": {
      "who": "friendly",
      "count": 1
    },
    "verify": "COST/RNG/AOE/DUR/OFF agree in S1, S2 and S10."
  },
  {
    "id": "trl.s.snipe",
    "name": "Snipe",
    "text": "A friendly Faction model or unit has its ranged weapons reach 3 inches further.",
    "cost": 2,
    "rng": 6,
    "dur": "UP",
    "offensive": false,
    "effect": [
      {
        "op": "modStat",
        "stat": "RNG",
        "value": 3
      }
    ],
    "scope": {
      "who": "friendly",
      "count": 1,
      "filter": { "code": "wholeUnit" }
    },
    "verify": "COST/RNG/AOE/DUR/OFF agree in S1, S2 and S10. Model or unit: wholeUnit makes a cast on a trooper cover its whole unit."
  },
  {
    "id": "trl.s.far-strike",
    "name": "Far Strike",
    "text": "This turn the caster's ranged weapons reach 3 inches further.",
    "cost": 1,
    "rng": "SELF",
    "dur": "TURN",
    "offensive": false,
    "animus": true,
    "effect": [
      {
        "op": "modStat",
        "stat": "RNG",
        "value": 3
      }
    ],
    "scope": {
      "who": "self"
    },
    "verify": "COST/RNG/AOE/DUR/OFF agree in S1, S2 and S10."
  }
]
